### ISSUE TITLE
"Beta User" - Battery Powered Camera - `wake_capture` not working. Video Doorbell Battery

### ISSUE THREAD

**Issue by s256** [borexola/neolink.net#44]
Hi, 
I found your project on reddit and also some comments about support for battery powered cameras.

Wanted to report that for Reolink Video Doorbell (Battery) - not Reolink Video Doorbell WiFI - thats a different model - the events and recordings functionality is not working - in terms of - the 'wake_capture` functionality is not working as described. 

I had multiple events / push notifications on the Reolink App in the last couple of hours, but not a single one in the neolink.net visible.
As you can see in the logs, there is not a anything happening for 6 hours, between I logged out and logged back in.

Is there anything I can do to help troubleshoot?

Relevant Config part:

```
  "cameras": [
    {
      "name": "frontdoor",
      "username": "barfoo",
      "password": "foobar",
      "address": "192.168.62.107:9000",
      "stream": "both",
      "uid": "DEADBEEF",
      "udp": true,
      "wake_capture": true
    }
  ],
  "ui": {
    "talk": true
  },
  "mqtt": {
....           // server health publish cadence in seconds
                                     // (0 = off, minimum 5; editable in the web UI)
  },
  "recording": {
    "path": "/recordings",           // storage directory
    "clips_path": "/clips",          // optional fast tier (SSD): new event clips land here,
                                     // 24/7 footage stays on "path"; unset = everything on "path"
    "archive_path": "/archive",      // optional cold tier: enables per-camera archiving in the
                                     // web UI — expired footage MOVES here instead of being
                                     // deleted. Use a different drive; in Docker, a second volume.
                                     // NOTE (Docker): map a volume at EVERY tier path you set —
                                     // an unmapped path is silently created inside the container
                                     // and that footage is lost when the container is recreated
    "retention_days": 7,             // delete events older than this (0 = keep forever)
    "pre_seconds": 5,                // video kept from before the detection
    "post_seconds": 8,               // quiet time before an event closes
    "max_clip_seconds": 120,         // hard cap per event/clip
    "stream": "auto",                // which stream to record: auto|mainStream|subStream
    "segment_minutes": 10,           // continuous recording: max length of one file
    "max_segment_size_mb": 256,      // continuous recording: max size of one file (rolls at whichever hits first)
    "continuous_retention_days": 7,  // continuous footage retention (default = retention_days)
    "encrypt": false                 // BETA: encrypt new footage at rest (AES-256-GCM). Playback and
                                     // old plaintext footage are unaffected. The key is NEOLINK_SECRET_KEY
                                     // or the state dir's secret.key — back it up (see README)
  }  
```

Logs in the timeframe:
```
neolink  | [2026-07-18 15:03:21.242] [INF] frontdoor (Main): no viewers for 60s — disconnecting so the battery camera can sleep
neolink  | [2026-07-18 15:03:21.292] [INF] frontdoor (Main): sleep-friendly (wake-capture) — letting the camera doze; will connect when it wakes itself (motion) or a viewer opens the stream
neolink  | [2026-07-18 15:03:21.912] [INF] frontdoor: capabilities discovered (ptz=False, led=True, pir=True, battery=True, talk=True, zoom=False, siren=True, floodlight=False, privacy=True, spotlight=False, whiteLed=False, doorbell=True, model=Reolink Video Doorbell)
neolink  | [2026-07-18 15:03:22.419] [INF] frontdoor (Sub): no viewers for 60s — disconnecting so the battery camera can sleep
neolink  | [2026-07-18 15:03:22.425] [INF] frontdoor (Sub): sleep-friendly (wake-capture) — letting the camera doze; will connect when it wakes itself (motion) or a viewer opens the stream
neolink  | [2026-07-18 21:34:53.788] [INF] frontdoor (Sub): camera is asleep — armed to connect on its next self-wake
neolink  | [2026-07-18 21:34:53.792] [INF] frontdoor (Main): camera is asleep — armed to connect on its next self-wake
neolink  | [2026-07-18 21:35:00.057] [INF] frontdoor (Sub): camera woke itself — connecting to catch the event
neolink  | [2026-07-18 21:35:00.057] [INF] frontdoor (Sub): connecting over UDP to 192.168.62.107 (uid set)
neolink  | [2026-07-18 21:35:00.058] [INF] frontdoor (Main): camera woke itself — connecting to catch the event
neolink  | [2026-07-18 21:35:00.058] [INF] frontdoor (Main): connecting over UDP to 192.168.62.107 (uid set)
neolink  | [2026-07-18 21:35:00.077] [INF] frontdoor (Sub): [udp] UDP session established — cid 150206646, did 884 (camera at 192.168.62.107:59242, timers def=3000/hb=20000/hbt=60000)
neolink  | [2026-07-18 21:35:00.077] [INF] frontdoor (Main): [udp] UDP session established — cid 889181696, did 885 (camera at 192.168.62.107:59242, timers def=3000/hb=20000/hbt=60000)
neolink  | [2026-07-18 21:35:00.078] [INF] frontdoor (Main): logging in as 'admin'
neolink  | [2026-07-18 21:35:00.078] [INF] frontdoor (Sub): logging in as 'admin'
neolink  | [2026-07-18 21:35:00.283] [INF] frontdoor (Main): logged in, camera reports 2048x2048
neolink  | [2026-07-18 21:35:00.284] [INF] frontdoor (Sub): logged in, camera reports 2048x2048
neolink  | [2026-07-18 21:35:00.398] [INF] frontdoor (Sub): receiving media
neolink  | [2026-07-18 21:35:00.509] [INF] frontdoor (Main): receiving media
neolink  | [2026-07-18 21:35:01.969] [INF] frontdoor (Sub): camera sent its UDP keepalive (msg 234) — replying (unanswered, battery cameras drop the session after ~8s)
neolink  | [2026-07-18 21:35:01.971] [INF] frontdoor (Main): camera sent its UDP keepalive (msg 234) — replying (unanswered, battery cameras drop the session after ~8s)
neolink  | [2026-07-18 21:35:03.389] [INF] frontdoor: capabilities discovered (ptz=False, led=True, pir=True, battery=True, talk=True, zoom=False, siren=True, floodlight=False, privacy=True, spotlight=False, whiteLed=False, doorbell=True, model=Reolink Video Doorbell)
neolink  | [2026-07-18 21:36:00.418] [INF] frontdoor (Sub): no viewers for 60s — disconnecting so the battery camera can sleep
neolink  | [2026-07-18 21:36:00.569] [INF] frontdoor (Main): no viewers for 60s — disconnecting so the battery camera can sleep
neolink  | [2026-07-18 21:36:51.579] [INF] frontdoor (Main): connecting over UDP to 192.168.62.107 (uid set)
neolink  | [2026-07-18 21:36:52.913] [INF] frontdoor (Main): [udp] UDP session established — cid 1814116539, did 0 (camera at 192.168.62.107:59242, timers def=3000/hb=10000/hbt=60000)
neolink  | [2026-07-18 21:36:52.914] [INF] frontdoor (Main): logging in as 'admin'
neolink  | [2026-07-18 21:36:53.051] [INF] frontdoor (Main): logged in, camera reports 2048x2048
neolink  | [2026-07-18 21:36:54.372] [INF] frontdoor (Main): receiving media
neolink  | [2026-07-18 21:36:54.931] [INF] frontdoor (Main): camera sent its UDP keepalive (msg 234) — replying (unanswered, battery cameras drop the session after ~8s)
neolink  | [2026-07-18 21:37:04.574] [INF] frontdoor: capabilities discovered (ptz=False, led=True, pir=True, battery=True, talk=True, zoom=False, siren=True, floodlight=False, privacy=True, spotlight=False, whiteLed=False, doorbell=True, model=Reolink Video Doorbell)
neolink  | [2026-07-18 21:38:35.277] [INF] frontdoor (Main): no viewers for 60s — disconnecting so the battery camera can sleep
neolink  | [2026-07-18 21:39:22.302] [INF] frontdoor (Main): connecting over UDP to 192.168.62.107 (uid set)
neolink  | [2026-07-18 21:39:23.475] [INF] frontdoor (Main): [udp] UDP session established — cid 1109282789, did 144 (camera at 192.168.62.107:59242, timers def=3000/hb=10000/hbt=60000)
neolink  | [2026-07-18 21:39:23.475] [INF] frontdoor (Main): logging in as 'admin'
neolink  | [2026-07-18 21:39:23.613] [INF] frontdoor (Main): logged in, camera reports 2048x2048
neolink  | [2026-07-18 21:39:24.860] [INF] frontdoor (Main): receiving media
neolink  | [2026-07-18 21:39:25.471] [INF] frontdoor (Main): camera sent its UDP keepalive (msg 234) — replying (unanswered, battery cameras drop the session after ~8s)
neolink  | [2026-07-18 21:39:26.152] [INF] frontdoor: capabilities discovered (ptz=False, led=True, pir=True, battery=True, talk=True, zoom=False, siren=True, floodlight=False, privacy=True, spotlight=False, whiteLed=False, doorbell=True, model=Reolink Video Doorbell)
```

**Comment by borexola** [comment]
Looking at your logs, the time gap is quite wide.

`neolink  | [2026-07-18 15:03:22.425] [INF] frontdoor (Sub): sleep-friendly (wake-capture) — letting the camera doze; will connect when it wakes itself (motion) or a viewer opens the stream`
then
`neolink  | [2026-07-18 21:34:53.788] [INF] frontdoor (Sub): camera is asleep — armed to connect on its next self-wake`

Is it possible your pc or docker went to sleep and resumed again a couple of hours later?
I expect a couple more lines from the logs from the time gap i see here.

**Comment by s256** [comment]
This is running on my Home-Server. With ca 20 other containers. No downtime.On 19. Jul 2026, at 00:28, Bori ***@***.***> wrote:﻿borexola left a comment (borexola/neolink.net#44)
Looking at your logs, the time gap is quite wide.
neolink  | [2026-07-18 15:03:22.425] [INF] frontdoor (Sub): sleep-friendly (wake-capture) — letting the camera doze; will connect when it wakes itself (motion) or a viewer opens the stream
then
neolink  | [2026-07-18 21:34:53.788] [INF] frontdoor (Sub): camera is asleep — armed to connect on its next self-wake
Is it possible your pc or docker went to sleep and resumed again a couple of hours later?
I expect a couple more lines from the logs from the time gap i see here.

**Comment by s256** [comment]
here are the logs from overnight. until right now. 
10:50am Berlin Time:

```
neolink  | [2026-07-18 22:18:11.752] [INF] frontdoor (Sub): no viewers for 60s — disconnecting so the battery camera can sleep
neolink  | [2026-07-18 22:19:43.785] [INF] frontdoor (Sub): camera is asleep — armed to connect on its next self-wake
neolink  | [2026-07-18 22:19:50.086] [INF] frontdoor (Sub): camera woke itself — connecting to catch the event
neolink  | [2026-07-18 22:19:50.086] [INF] frontdoor (Sub): connecting over UDP to 192.168.62.107 (uid set)
neolink  | [2026-07-18 22:19:50.121] [INF] frontdoor (Sub): [udp] UDP session established — cid 1501702706, did 577 (camera at 192.168.62.107:19577, timers def=3000/hb=10000/hbt=60000)
neolink  | [2026-07-18 22:19:50.121] [INF] frontdoor (Sub): logging in as 'barfoo'
neolink  | [2026-07-18 22:19:50.207] [INF] frontdoor (Sub): logged in, camera reports 2048x2048
neolink  | [2026-07-18 22:19:51.513] [INF] frontdoor (Sub): receiving media
neolink  | [2026-07-18 22:19:52.106] [INF] frontdoor (Sub): camera sent its UDP keepalive (msg 234) — replying (unanswered, battery cameras drop the session after ~8s)
neolink  | [2026-07-18 22:19:53.793] [INF] frontdoor: capabilities discovered (ptz=False, led=True, pir=True, battery=True, talk=True, zoom=False, siren=True, floodlight=False, privacy=True, spotlight=False, whiteLed=False, doorbell=True, model=Reolink Video Doorbell)
neolink  | [2026-07-18 22:20:51.543] [INF] frontdoor (Sub): no viewers for 60s — disconnecting so the battery camera can sleep
neolink  | [2026-07-19 03:30:42.454] [INF] frontdoor (Sub): camera is asleep — armed to connect on its next self-wake
neolink  | [2026-07-19 03:30:42.455] [INF] frontdoor (Main): camera is asleep — armed to connect on its next self-wake
neolink  | [2026-07-19 03:30:56.942] [INF] frontdoor (Sub): camera woke itself — connecting to catch the event
neolink  | [2026-07-19 03:30:56.942] [INF] frontdoor (Main): camera woke itself — connecting to catch the event
neolink  | [2026-07-19 03:30:56.942] [INF] frontdoor (Sub): connecting over UDP to 192.168.62.107 (uid set)
neolink  | [2026-07-19 03:30:56.942] [INF] frontdoor (Main): connecting over UDP to 192.168.62.107 (uid set)
neolink  | [2026-07-19 03:30:56.983] [INF] frontdoor (Main): [udp] UDP session established — cid 1755639200, did 243 (camera at 192.168.62.107:38246, timers def=3000/hb=10000/hbt=60000)
neolink  | [2026-07-19 03:30:56.983] [INF] frontdoor (Sub): [udp] UDP session established — cid 12593097, did 242 (camera at 192.168.62.107:38246, timers def=3000/hb=10000/hbt=60000)
neolink  | [2026-07-19 03:30:56.993] [INF] frontdoor (Main): logging in as 'barfoo'
neolink  | [2026-07-19 03:30:56.993] [INF] frontdoor (Sub): logging in as 'barfoo'
neolink  | [2026-07-19 03:30:57.104] [INF] frontdoor (Sub): logged in, camera reports 2048x2048
neolink  | [2026-07-19 03:30:57.104] [INF] frontdoor (Main): logged in, camera reports 2048x2048
neolink  | [2026-07-19 03:30:58.829] [INF] frontdoor (Main): receiving media
neolink  | [2026-07-19 03:30:58.879] [INF] frontdoor (Sub): receiving media
neolink  | [2026-07-19 03:30:58.968] [INF] frontdoor (Sub): camera sent its UDP keepalive (msg 234) — replying (unanswered, battery cameras drop the session after ~8s)
neolink  | [2026-07-19 03:30:59.051] [INF] frontdoor (Main): camera sent its UDP keepalive (msg 234) — replying (unanswered, battery cameras drop the session after ~8s)
neolink  | [2026-07-19 03:31:16.043] [INF] frontdoor: capabilities discovered (ptz=False, led=True, pir=True, battery=True, talk=True, zoom=False, siren=True, floodlight=False, privacy=True, spotlight=False, whiteLed=False, doorbell=True, model=Reolink Video Doorbell)
neolink  | [2026-07-19 03:31:58.897] [INF] frontdoor (Sub): no viewers for 60s — disconnecting so the battery camera can sleep
neolink  | [2026-07-19 03:31:58.899] [INF] frontdoor (Main): no viewers for 60s — disconnecting so the battery camera can sleep
neolink  | [2026-07-19 03:34:33.391] [INF] frontdoor (Sub): camera is asleep — armed to connect on its next self-wake
neolink  | [2026-07-19 03:34:33.894] [INF] frontdoor (Main): camera is asleep — armed to connect on its next self-wake
neolink  | [2026-07-19 03:34:39.022] [INF] frontdoor (Main): camera woke itself — connecting to catch the event
neolink  | [2026-07-19 03:34:39.022] [INF] frontdoor (Main): connecting over UDP to 192.168.62.107 (uid set)
neolink  | [2026-07-19 03:34:39.059] [INF] frontdoor (Main): [udp] UDP session established — cid 1445406373, did 467 (camera at 192.168.62.107:38246, timers def=3000/hb=20000/hbt=60000)
neolink  | [2026-07-19 03:34:39.061] [INF] frontdoor (Main): logging in as 'barfoo'
neolink  | [2026-07-19 03:34:39.222] [INF] frontdoor (Main): logged in, camera reports 2048x2048
neolink  | [2026-07-19 03:34:39.329] [INF] frontdoor (Main): receiving media
neolink  | [2026-07-19 03:34:39.392] [INF] frontdoor (Main): camera sent its UDP keepalive (msg 234) — replying (unanswered, battery cameras drop the session after ~8s)
neolink  | [2026-07-19 03:34:39.443] [INF] frontdoor (Sub): camera woke itself — connecting to catch the event
neolink  | [2026-07-19 03:34:39.443] [INF] frontdoor (Sub): connecting over UDP to 192.168.62.107 (uid set)
neolink  | [2026-07-19 03:34:39.510] [INF] frontdoor (Sub): [udp] UDP session established — cid 2017204044, did 469 (camera at 192.168.62.107:38246, timers def=3000/hb=20000/hbt=60000)
neolink  | [2026-07-19 03:34:39.511] [INF] frontdoor (Sub): logging in as 'barfoo'dx
neolink  | [2026-07-19 03:34:39.656] [INF] frontdoor (Sub): logged in, camera reports 2048x2048
neolink  | [2026-07-19 03:34:39.997] [INF] frontdoor (Sub): receiving media
neolink  | [2026-07-19 03:34:41.353] [INF] frontdoor (Sub): camera sent its UDP keepalive (msg 234) — replying (unanswered, battery cameras drop the session after ~8s)
neolink  | [2026-07-19 03:34:57.166] [INF] frontdoor: capabilities discovered (ptz=False, led=True, pir=True, battery=True, talk=True, zoom=False, siren=True, floodlight=False, privacy=True, spotlight=False, whiteLed=False, doorbell=True, model=Reolink Video Doorbell)
neolink  | [2026-07-19 03:35:39.370] [INF] frontdoor (Main): no viewers for 60s — disconnecting so the battery camera can sleep
neolink  | [2026-07-19 03:35:40.030] [INF] frontdoor (Sub): no viewers for 60s — disconnecting so the battery camera can sleep
neolink  | [2026-07-19 04:04:45.419] [INF] frontdoor (Sub): camera is asleep — armed to connect on its next self-wake
neolink  | [2026-07-19 04:04:45.419] [INF] frontdoor (Main): camera is asleep — armed to connect on its next self-wake
neolink  | [2026-07-19 04:04:50.843] [INF] frontdoor (Sub): camera woke itself — connecting to catch the event
neolink  | [2026-07-19 04:04:50.843] [INF] frontdoor (Sub): connecting over UDP to 192.168.62.107 (uid set)
neolink  | [2026-07-19 04:04:50.844] [INF] frontdoor (Main): camera woke itself — connecting to catch the event
neolink  | [2026-07-19 04:04:50.844] [INF] frontdoor (Main): connecting over UDP to 192.168.62.107 (uid set)
neolink  | [2026-07-19 04:04:50.890] [INF] frontdoor (Sub): [udp] UDP session established — cid 317632302, did 276 (camera at 192.168.62.107:38246, timers def=3000/hb=20000/hbt=60000)
neolink  | [2026-07-19 04:04:50.890] [INF] frontdoor (Sub): logging in as 'barfoo'
neolink  | [2026-07-19 04:04:50.893] [INF] frontdoor (Main): [udp] UDP session established — cid 1861074436, did 277 (camera at 192.168.62.107:38246, timers def=3000/hb=20000/hbt=60000)
neolink  | [2026-07-19 04:04:50.894] [INF] frontdoor (Main): logging in as 'barfoo'
neolink  | [2026-07-19 04:04:51.076] [INF] frontdoor (Main): logged in, camera reports 2048x2048
neolink  | [2026-07-19 04:04:51.076] [INF] frontdoor (Sub): logged in, camera reports 2048x2048
neolink  | [2026-07-19 04:04:51.174] [INF] frontdoor (Sub): receiving media
neolink  | [2026-07-19 04:04:51.222] [INF] frontdoor (Main): receiving media
neolink  | [2026-07-19 04:04:51.311] [INF] frontdoor (Sub): camera sent its UDP keepalive (msg 234) — replying (unanswered, battery cameras drop the session after ~8s)
neolink  | [2026-07-19 04:04:51.379] [INF] frontdoor (Main): camera sent its UDP keepalive (msg 234) — replying (unanswered, battery cameras drop the session after ~8s)
neolink  | [2026-07-19 04:04:58.287] [INF] frontdoor: capabilities discovered (ptz=False, led=True, pir=True, battery=True, talk=True, zoom=False, siren=True, floodlight=False, privacy=True, spotlight=False, whiteLed=False, doorbell=True, model=Reolink Video Doorbell)
neolink  | [2026-07-19 04:05:51.186] [INF] frontdoor (Sub): no viewers for 60s — disconnecting so the battery camera can sleep
neolink  | [2026-07-19 04:05:51.242] [INF] frontdoor (Main): no viewers for 60s — disconnecting so the battery camera can sleep
```

I am now pulling the latest version 0.9.5 from a couple of hours again.

**Comment by s256** [comment]
I also saw, that the battery is draining since running neolink.net (saw the same behaviour on other neolink projects as well as on my own experiments).  

<img width="804" height="631" alt="Image" src="https://github.com/user-attachments/assets/a0c9903b-ba08-40bb-9527-eae118298119" />

**Comment by Rihan9** [comment]
> I also saw, that the battery is draining since running neolink.net (saw the same behaviour on other neolink projects as well as on my own experiments).
> <img alt="Image" width="804" height="631" src="https://private-user-images.githubusercontent.com/1517486/623638523-a0c9903b-ba08-40bb-9527-eae118298119.png?jwt=eyJ0eXAiOiJKV1QiLCJhbGciOiJIUzI1NiJ9.eyJpc3MiOiJnaXRodWIuY29tIiwiYXVkIjoicmF3LmdpdGh1YnVzZXJjb250ZW50LmNvbSIsImtleSI6ImtleTUiLCJleHAiOjE3ODQ0NTQ4NjksIm5iZiI6MTc4NDQ1NDU2OSwicGF0aCI6Ii8xNTE3NDg2LzYyMzYzODUyMy1hMGM5OTAzYi1iYTA4LTQwYmItOTUyNy1lYWUxMTgyOTgxMTkucG5nP1gtQW16LUFsZ29yaXRobT1BV1M0LUhNQUMtU0hBMjU2JlgtQW16LUNyZWRlbnRpYWw9QUtJQVZDT0RZTFNBNTNQUUs0WkElMkYyMDI2MDcxOSUyRnVzLWVhc3QtMSUyRnMzJTJGYXdzNF9yZXF1ZXN0JlgtQW16LURhdGU9MjAyNjA3MTlUMDk0OTI5WiZYLUFtei1FeHBpcmVzPTMwMCZYLUFtei1TaWduYXR1cmU9ZDIzZDI1MTNmMzAyYWMwZTNhOWMwNWMxMGZhMzAyMWQ1ZTY3Y2QwYjQ4YTMxYzliZWE4MzJhNDlmMzc5MTVmZCZYLUFtei1TaWduZWRIZWFkZXJzPWhvc3QmcmVzcG9uc2UtY29udGVudC10eXBlPWltYWdlJTJGcG5nIn0.olPgAlqsTvx5p_8vy5gEnIvb_6Yu9K5OalPlUr3LAqw">

Hi!.
I was about to report the same problem. The battery drain is quite high right now with neolink. The solar panel connected with my battery camera cannot keep up with the power consumpion:

<img width="2063" height="439" alt="Image" src="https://github.com/user-attachments/assets/2a92d644-a8b6-4ce9-bcfa-a960505def8c" />.

**Comment by borexola** [comment]
Thanks for the logs and screenshots. 

I pushed some changes to `:beta`

- Neolink no longer reacts to a single missed knock,  it needs two in a row, which stops the false wake-ups.

- Only one connection is made per event instead of two, and Neolink lets the camera go back to sleep after 20 seconds instead of 60 — without cutting a recording short.

- I also added extra logging to capture the camera's response to my probe when its asleep

I know it takes some hours for the battery issue to manifest, please let me logs and graphs when you can. thanks.

**Comment by s256** [comment]
Pulled the latest beta image and will report back. Thank you!On 19. Jul 2026, at 14:33, Bori ***@***.***> wrote:﻿borexola left a comment (borexola/neolink.net#44)
Thanks for the logs and screenshots.
I pushed some changes to :beta


Neolink no longer reacts to a single missed knock,  it needs two in a row, which stops the false wake-ups.


Only one connection is made per event instead of two, and Neolink lets the camera go back to sleep after 20 seconds instead of 60 — without cutting a recording short.


I also added extra logging to capture the camera's response to my probe when its asleep


I know it takes some hours for the battery issue to manifest, please let me logs and graphs when you can. thanks.

**Comment by borexola** [comment]
Let me know if you are begining to see any trend or interesting logs.
Ive ordered a battery powered cam. So I should be able to do more validation in a couple of days.

**Comment by s256** [comment]
Logs after 8hours running `0.9.6-beta.126`. 
```
neolink  | [2026-07-19 13:53:49.625] [INF] Neolink.NET 0.9.6-beta.126 starting
neolink  | [2026-07-19 13:53:49.641] [INF] Local time: 2026-07-19 13:53:49 (Europe/London, UTC+01:00) — set the TZ env var to change it
neolink  | [2026-07-19 13:53:49.665] [INF] Recording to /recordings (default retention — events: 7 days, continuous: 7 days; per-camera overrides apply)
neolink  | [2026-07-19 13:53:49.665] [INF] Recording: event clips go to the fast tier at /clips
neolink  | [2026-07-19 13:53:49.665] [INF] Recording: archive tier at /archive — cameras opt in from the web UI
neolink  | [2026-07-19 13:53:49.686] [WRN] Storage: Recordings (/recordings) and Clips (fast) (/clips) and Archive (/archive) report identical capacity — they are probably on the SAME filesystem, not the separate drives you configured. In Docker, recreate the container (docker compose up -d --force-recreate) and make sure the drives are mounted before Docker starts.
neolink  | [2026-07-19 13:53:50.169] [INF] frontdoor (Sub): delaying startup by 2s
neolink  | [2026-07-19 13:53:50.197] [INF] frontdoor (Main): connecting over UDP to 192.168.62.107 (uid set)
neolink  | [2026-07-19 13:53:50.228] [INF] frontdoor: event recording enabled (frontdoor mainStream, pre=5s, post=8s, previews from frontdoor subStream)
neolink  | [2026-07-19 13:53:50.359] [INF] MQTT: Home Assistant bridge enabled → 192.168.62.206:1883 (base topic 'neolink', discovery on, server health every 60s)
neolink  | [2026-07-19 13:53:50.436] [INF] RTSP server listening on rtsp://0.0.0.0:8654/
neolink  | [2026-07-19 13:53:50.509] [INF]   Stream: rtsp://192.168.62.5:8654/frontdoor
neolink  | [2026-07-19 13:53:50.509] [INF]   Stream: rtsp://192.168.62.5:8654/frontdoor/mainStream
neolink  | [2026-07-19 13:53:50.509] [INF]   Stream: rtsp://192.168.62.5:8654/frontdoor/subStream
neolink  | [2026-07-19 13:53:50.715] [INF] MQTT: connected to 192.168.62.206:1883 as 'neolink'
neolink  | [2026-07-19 13:53:50.993] [INF]   Web UI: http://192.168.62.5:8655/
neolink  | [2026-07-19 13:53:50.993] [INF]   API:    http://192.168.62.5:8655/api/cameras
neolink  | [2026-07-19 13:53:51.601] [INF] frontdoor (Main): [udp] UDP session established — cid 212358889, did 624 (camera at 192.168.62.107:24372, timers def=3000/hb=10000/hbt=60000)
neolink  | [2026-07-19 13:53:51.632] [INF] frontdoor (Main): logging in as 'barfoo'
neolink  | [2026-07-19 13:53:51.922] [INF] BC frontdoor (Main): encryption negotiated: FullAes (0x12, media stream encrypted)
neolink  | [2026-07-19 13:53:51.924] [INF] frontdoor (Main): logged in, camera reports 2048x2048
neolink  | [2026-07-19 13:53:52.173] [INF] frontdoor (Sub): connecting over UDP to 192.168.62.107 (uid set)
neolink  | [2026-07-19 13:53:52.218] [INF] frontdoor (Sub): [udp] UDP session established — cid 263793918, did 625 (camera at 192.168.62.107:24372, timers def=3000/hb=20000/hbt=60000)
neolink  | [2026-07-19 13:53:52.218] [INF] frontdoor (Sub): logging in as 'barfoo'
neolink  | [2026-07-19 13:53:52.339] [INF] BC frontdoor (Sub): encryption negotiated: FullAes (0x12, media stream encrypted)
neolink  | [2026-07-19 13:53:52.340] [INF] frontdoor (Sub): logged in, camera reports 2048x2048
neolink  | [2026-07-19 13:53:53.233] [INF] frontdoor (Sub): battery-powered camera detected (battery at 61%, charging); it will sleep while nobody watches (set "always_on": true to keep it awake)
neolink  | [2026-07-19 13:53:53.233] [INF] frontdoor (Main): battery-powered camera detected (battery at 61%, charging); it will sleep while nobody watches (set "always_on": true to keep it awake)
neolink  | [2026-07-19 13:53:53.323] [INF] frontdoor (Main): receiving media
neolink  | [2026-07-19 13:53:53.386] [INF] frontdoor (Sub): receiving media
neolink  | [2026-07-19 13:53:53.567] [INF] frontdoor (Main): camera sent its UDP keepalive (msg 234) — replying (unanswered, battery cameras drop the session after ~8s)
neolink  | [2026-07-19 13:53:53.570] [INF] frontdoor (Sub): camera sent its UDP keepalive (msg 234) — replying (unanswered, battery cameras drop the session after ~8s)
neolink  | [2026-07-19 13:54:10.708] [INF] frontdoor: capabilities discovered (ptz=False, led=True, pir=True, battery=True, talk=True, zoom=False, siren=True, floodlight=False, privacy=True, spotlight=False, whiteLed=False, doorbell=True, model=Reolink Video Doorbell)
neolink  | [2026-07-19 13:54:11.317] [INF] frontdoor: ONVIF imaging fallback unavailable — GetVideoSources: Connection refused (192.168.62.107:80) (http://192.168.62.107/onvif/media_service). If this camera has no Reolink HTTP API, check that ONVIF is enabled on it (Reolink app > Settings > Network > Advanced > ONVIF/Port Settings), and if ONVIF is on a non-standard port set 'onvif_address' (e.g. "192.168.62.107:8000"). Retrying in 5 min.
neolink  | [2026-07-19 13:54:13.356] [INF] frontdoor (Main): no viewers for 20s — disconnecting so the battery camera can sleep
neolink  | [2026-07-19 13:54:13.407] [INF] frontdoor (Main): sleep-friendly (wake-capture) — letting the camera doze; will connect when it wakes itself (motion) or a viewer opens the stream
neolink  | [2026-07-19 13:54:13.417] [INF] frontdoor (Sub): no viewers for 20s — disconnecting so the battery camera can sleep
neolink  | [2026-07-19 13:54:13.421] [INF] frontdoor (Sub): parked — the recording stream watches for self-wakes; this stream connects when a viewer opens it


neolink  | [2026-07-19 21:34:23.446] [INF] frontdoor (Main): connecting over UDP to 192.168.62.107 (uid set)
neolink  | [2026-07-19 21:34:23.756] [INF] frontdoor (Main): [udp] UDP session established — cid 151771658, did 241 (camera at 192.168.62.107:50054, timers def=3000/hb=20000/hbt=60000)
neolink  | [2026-07-19 21:34:23.757] [INF] frontdoor (Main): logging in as 'barfoo'
neolink  | [2026-07-19 21:34:23.903] [INF] frontdoor (Main): logged in, camera reports 2048x2048
neolink  | [2026-07-19 21:34:24.017] [INF] frontdoor (Main): receiving media
neolink  | [2026-07-19 21:34:25.495] [INF] frontdoor (Main): camera sent its UDP keepalive (msg 234) — replying (unanswered, battery cameras drop the session after ~8s)
```

Battery down from 61% to 49%

<img width="809" height="697" alt="Image" src="https://github.com/user-attachments/assets/e77ed0c1-e051-4795-9db3-6764c2e39fb9" />

No Events or activity despite 4 events/recordings on camera in that timeframe incl. detections.

**Comment by borexola** [comment]
Thank you.
How much battery percentage drop would have ideally occurred in that time frame?
I know detection works for some users as is. Its possible you model or firmware is behaving differently.
Give me a couple of days. I'll test against a wireless cam when it arrives. Hopefully i can have something conclusive here.

**Comment by s256** [comment]
So this model of doorbell, similar to ring and many others, is attached and charged via the original wiring of the doorbell - as described in their [official docs](https://support.reolink.com/articles/10313334138265-How-to-Install-Reolink-Video-Doorbell-Cameras-to-the-Existing-Doorbell-Wiring/).
There is no other power source available for me and I can't install solar. 
So usually, just with the app and push notifications, the battery usage in the same period is almost _zero_. 

The current on these transformers while inactive is not high, hence the charging is super slow. But due to the fact that a doorbell is only active for a couple of seconds a day, that is sufficient.

I stopped the container for now, so the battery charge can recover.

**Comment by borexola** [comment]
Okay thanks, 
I'll start doing some validation testing on a battery cam tomorrow. I should have some feedback by weekend.

**Comment by borexola** [comment]
I just released v0.9.6
Ive been hard at work with the Argus Solar.
Everything about it is very tricky and encrypted.
I will keep trying and improvements will come in future versions as I discover new methods.

I got it working fairly decently with a work around using opnsense logs. see: 
[Battery Cameras](https://github.com/borexola/neolink.net/blob/main/docs/battery-cameras.md)

**Comment by s256** [comment]
I will test it next week with the doorbell, when I am back from vacation. Looking forward to it.On 22. Jul 2026, at 20:38, Bori ***@***.***> wrote:﻿borexola left a comment (borexola/neolink.net#44)
I just released v0.9.6
Ive been hard at work with the Argus Solar.
Everything about it is very tricky and encrypted.
I will keep trying and improvements will come in future versions as I discover new methods.
I got it working fairly decently with a work around using opnsense logs. see: https://github.com/borexola/neolink.net/blob/main/docs/battery-cameras.md

**Comment by Rihan9** [comment]
Hi @borexola,
Have you considered having your software act as the notification server instead?

Let me explain: your software could listen on the port where the camera normally sends the notification to trigger the push alert (it should be port 53 according to my logs). Then, on the router, we would only need to set up a DNS override so that the hostname `pushx.reolink.com ` resolves to our server's IP. This way, we wouldn't need to set up the firewall rule plus the syslog redirect, which in my opinion seems more complicated. The downside that i can think of is that this will broke the notification on the smartphone, but we can easily replace it in home assistant.

I'm suggesting this because i think it's more common to have a custom DNS, or a router that allow a DNS override. Personally, I have a router with openWRT and I couldn't let this update works correctly unfortunately. The firewall roules doesn't seems to write anything on syslog, and the syslog connection itself is unstable

**Comment by borexola** [comment]
Hey, I did think about this. Infact I have a local branch with a draft of this implementation.
But I got concerned that users will lose access to Reolink's own notification entirely.
So you will need to fully rely on my app to relay everything for you to HA.
I can add it into a beta release for you to try out if you down to test it.

Edit:
Im fairly confident in your suggested approach. Its implemented in the new realease

**Comment by Rihan9** [comment]
Hi!
let me know if you want me to do some tests! Honestly, I'd willingly forego standard notifications if that's what it takes to get replies to events in NeoLink. As I said, I can re-implement them in HA. As a future improvement, if you want, obviusly, you might also consider implementing Shoutrr. That way, you could not only restore notifications without HA, but also implement custom notifications.

**Comment by borexola** [comment]
Great. Let me know how the latest release works for your battery cam.

**Comment by Rihan9** [comment]
should I use the `beta` or the `latest` tag in the image to have it?

**Comment by borexola** [comment]
Latest has it. 
Regarding Shoutrr, I have plans to integrate other notifications channels down the line. So it will get better.
Please see: [Release Notes](https://github.com/borexola/neolink.net/releases/tag/v0.9.7)

**Comment by Rihan9** [comment]
Hi, 
sorry for the late reply. I was trying to test it and have as many data as possible to help, but the behavior of the battery camera and neolink has been inconsistent to say the least.
In 3 tests of 4, the Motion sensor wasn't triggered, and sometimes it triggered by itself (maybe the wind I guess). The person sensor was never triggered.

My dns configuration:

<img width="1337" height="880" alt="Image" src="https://github.com/user-attachments/assets/05ba2cea-21c3-4da2-a955-92bed67eba7e" />

I activated a sniffer on my router, here the dump of one of the test:
```
tcpdump src 192.168.178.50
tcpdump: verbose output suppressed, use -v or -vv for full protocol decode
listening on br-lan, link-type EN10MB (Ethernet), capture size 262144 bytes
18:09:09.841668 IP 192.168.178.50 > 192.168.178.2: ICMP echo reply, id 2183, seq 0, length 40
18:09:11.910058 IP 192.168.178.50.17940 > 104-105-81-140.ip.linodeusercontent.com.58200: UDP, length 124
18:09:13.583464 IP 192.168.178.50 > 192.168.178.2: ICMP echo reply, id 38009, seq 0, length 40
18:09:15.831862 ARP, Reply 192.168.178.50 is-at 1c:63:49:88:54:77 (oui Unknown), length 28
18:09:16.901244 IP 192.168.178.50 > 192.168.178.2: ICMP echo reply, id 9506, seq 0, length 40
18:09:20.751595 IP 192.168.178.50 > 192.168.178.2: ICMP echo reply, id 47547, seq 0, length 40
18:09:24.234082 IP 192.168.178.50 > 192.168.178.2: ICMP echo reply, id 62584, seq 0, length 40
18:09:24.844028 ARP, Reply 192.168.178.50 is-at 1c:63:49:88:54:77 (oui Unknown), length 28
18:09:27.660118 IP 192.168.178.50 > 192.168.178.2: ICMP echo reply, id 56015, seq 0, length 40
18:09:31.107981 IP 192.168.178.50 > 192.168.178.2: ICMP echo reply, id 39816, seq 0, length 40
18:09:31.917571 IP 192.168.178.50.17940 > 104-105-81-140.ip.linodeusercontent.com.58200: UDP, length 124
18:09:38.461695 ARP, Reply 192.168.178.50 is-at 1c:63:49:88:54:77 (oui Unknown), length 28
18:09:38.461978 IP 192.168.178.50 > 192.168.178.2: ICMP echo reply, id 62556, seq 0, length 40
18:09:38.508082 IP 192.168.178.50 > 192.168.178.2: ICMP echo reply, id 54421, seq 0, length 40
18:09:40.719584 IP 192.168.178.50 > 192.168.178.2: ICMP echo reply, id 33933, seq 0, length 40
18:09:43.790063 IP 192.168.178.50 > 192.168.178.2: ICMP echo reply, id 52685, seq 0, length 40
18:09:45.324019 ARP, Reply 192.168.178.50 is-at 1c:63:49:88:54:77 (oui Unknown), length 28
18:09:45.834146 ARP, Reply 192.168.178.50 is-at 1c:63:49:88:54:77 (oui Unknown), length 28
18:09:46.907503 IP 192.168.178.50 > 192.168.178.2: ICMP echo reply, id 43632, seq 0, length 40
18:09:50.241340 IP 192.168.178.50 > 192.168.178.2: ICMP echo reply, id 24941, seq 0, length 40
18:09:51.925279 IP 192.168.178.50.17940 > 104-105-81-140.ip.linodeusercontent.com.58200: UDP, length 124
18:09:53.518736 IP 192.168.178.50 > 192.168.178.2: ICMP echo reply, id 61909, seq 0, length 40
18:09:55.563834 ARP, Reply 192.168.178.50 is-at 1c:63:49:88:54:77 (oui Unknown), length 28
18:09:56.636296 IP 192.168.178.50 > 192.168.178.2: ICMP echo reply, id 34371, seq 0, length 40
18:10:00.481399 IP 192.168.178.50 > 192.168.178.2: ICMP echo reply, id 63277, seq 0, length 40
18:10:03.553782 IP 192.168.178.50 > 192.168.178.2: ICMP echo reply, id 53860, seq 0, length 40
18:10:06.111068 ARP, Reply 192.168.178.50 is-at 1c:63:49:88:54:77 (oui Unknown), length 28
18:10:06.675344 IP 192.168.178.50 > 192.168.178.2: ICMP echo reply, id 13147, seq 0, length 40
18:10:09.903717 IP 192.168.178.50 > 192.168.178.2: ICMP echo reply, id 2179, seq 0, length 40
18:10:11.013066 IP 192.168.178.50.17940 > 104-105-81-140.ip.linodeusercontent.com.58200: UDP, length 124
18:10:13.197349 IP 192.168.178.50 > 192.168.178.2: ICMP echo reply, id 11779, seq 0, length 40
18:10:16.349813 ARP, Reply 192.168.178.50 is-at 1c:63:49:88:54:77 (oui Unknown), length 28
18:10:16.404016 IP 192.168.178.50 > 192.168.178.2: ICMP echo reply, id 9008, seq 0, length 40
18:10:17.989525 ARP, Reply 192.168.178.50 is-at 1c:63:49:88:54:77 (oui Unknown), length 28
18:10:19.573484 IP 192.168.178.50 > 192.168.178.2: ICMP echo reply, id 64663, seq 0, length 40
18:10:22.703864 IP 192.168.178.50 > 192.168.178.2: ICMP echo reply, id 54654, seq 0, length 40
18:10:25.878165 IP 192.168.178.50 > 192.168.178.2: ICMP echo reply, id 61346, seq 0, length 40
18:10:26.285211 ARP, Reply 192.168.178.50 is-at 1c:63:49:88:54:77 (oui Unknown), length 28
18:10:29.004171 IP 192.168.178.50 > 192.168.178.2: ICMP echo reply, id 20193, seq 0, length 40
18:10:31.020223 IP 192.168.178.50.17940 > 104-105-81-140.ip.linodeusercontent.com.58200: UDP, length 124
18:10:32.017651 IP 192.168.178.50 > 192.168.178.2: ICMP echo reply, id 16806, seq 0, length 40
18:10:34.070637 IP 192.168.178.50 > 192.168.178.2: ICMP echo reply, id 6807, seq 0, length 40
18:10:36.625894 ARP, Reply 192.168.178.50 is-at 1c:63:49:88:54:77 (oui Unknown), length 28
18:10:37.294240 IP 192.168.178.50 > 192.168.178.2: ICMP echo reply, id 62671, seq 0, length 40
18:10:40.418802 IP 192.168.178.50 > 192.168.178.2: ICMP echo reply, id 52582, seq 0, length 40
18:10:43.491035 IP 192.168.178.50 > 192.168.178.2: ICMP echo reply, id 19498, seq 0, length 40
18:10:46.866101 ARP, Reply 192.168.178.50 is-at 1c:63:49:88:54:77 (oui Unknown), length 28
18:10:46.866505 IP 192.168.178.50 > 192.168.178.2: ICMP echo reply, id 51788, seq 0, length 40
18:10:49.989588 IP 192.168.178.50 > 192.168.178.2: ICMP echo reply, id 1157, seq 0, length 40
18:10:51.027903 IP 192.168.178.50.17940 > 104-105-81-140.ip.linodeusercontent.com.58200: UDP, length 124
18:10:51.781571 ARP, Reply 192.168.178.50 is-at 1c:63:49:88:54:77 (oui Unknown), length 28
18:10:53.158901 IP 192.168.178.50 > 192.168.178.2: ICMP echo reply, id 64583, seq 0, length 40
18:10:56.393307 IP 192.168.178.50 > 192.168.178.2: ICMP echo reply, id 53082, seq 0, length 40
18:10:57.005913 ARP, Reply 192.168.178.50 is-at 1c:63:49:88:54:77 (oui Unknown), length 28
18:10:59.508131 IP 192.168.178.50 > 192.168.178.2: ICMP echo reply, id 15507, seq 0, length 40
18:11:02.641253 IP 192.168.178.50 > 192.168.178.2: ICMP echo reply, id 55609, seq 0, length 40
18:11:05.711740 IP 192.168.178.50 > 192.168.178.2: ICMP echo reply, id 62904, seq 0, length 40
18:11:07.754737 ARP, Reply 192.168.178.50 is-at 1c:63:49:88:54:77 (oui Unknown), length 28
18:11:08.936860 IP 192.168.178.50 > 192.168.178.2: ICMP echo reply, id 47092, seq 0, length 40
18:11:11.035565 IP 192.168.178.50.17940 > 104-105-81-140.ip.linodeusercontent.com.58200: UDP, length 124
18:11:11.962353 IP 192.168.178.50 > 192.168.178.2: ICMP echo reply, id 51174, seq 0, length 40
18:11:13.085195 IP 192.168.178.50 > 192.168.178.2: ICMP echo reply, id 53622, seq 0, length 40
18:11:16.156629 IP 192.168.178.50 > 192.168.178.2: ICMP echo reply, id 19466, seq 0, length 40
18:11:17.687646 ARP, Reply 192.168.178.50 is-at 1c:63:49:88:54:77 (oui Unknown), length 28
18:11:19.275666 IP 192.168.178.50 > 192.168.178.2: ICMP echo reply, id 56343, seq 0, length 40
18:11:22.403209 IP 192.168.178.50 > 192.168.178.2: ICMP echo reply, id 64560, seq 0, length 40
18:11:24.958078 ARP, Reply 192.168.178.50 is-at 1c:63:49:88:54:77 (oui Unknown), length 28
18:11:25.524696 IP 192.168.178.50 > 192.168.178.2: ICMP echo reply, id 44544, seq 0, length 40
18:11:28.132480 ARP, Reply 192.168.178.50 is-at 1c:63:49:88:54:77 (oui Unknown), length 28
18:11:28.694323 IP 192.168.178.50 > 192.168.178.2: ICMP echo reply, id 24286, seq 0, length 40
18:11:31.042537 IP 192.168.178.50.17940 > 104-105-81-140.ip.linodeusercontent.com.58200: UDP, length 124
18:11:31.721937 IP 192.168.178.50 > 192.168.178.2: ICMP echo reply, id 876, seq 0, length 40
18:11:33.157571 IP 192.168.178.50 > 192.168.178.2: ICMP echo reply, id 33253, seq 0, length 40
18:11:36.227460 IP 192.168.178.50 > 192.168.178.2: ICMP echo reply, id 15513, seq 0, length 40
18:11:38.270141 ARP, Reply 192.168.178.50 is-at 1c:63:49:88:54:77 (oui Unknown), length 28
18:11:39.346035 IP 192.168.178.50 > 192.168.178.2: ICMP echo reply, id 8934, seq 0, length 40
18:11:42.473940 IP 192.168.178.50 > 192.168.178.2: ICMP echo reply, id 1001, seq 0, length 40
18:11:45.646465 IP 192.168.178.50 > 192.168.178.2: ICMP echo reply, id 55380, seq 0, length 40
18:11:48.920303 ARP, Reply 192.168.178.50 is-at 1c:63:49:88:54:77 (oui Unknown), length 28
18:11:48.972066 IP 192.168.178.50 > 192.168.178.2: ICMP echo reply, id 37473, seq 0, length 40
18:11:50.139861 IP 192.168.178.50.17940 > 104-105-81-140.ip.linodeusercontent.com.58200: UDP, length 124
18:11:52.201910 IP 192.168.178.50 > 192.168.178.2: ICMP echo reply, id 27602, seq 0, length 40
18:11:55.274291 IP 192.168.178.50 > 192.168.178.2: ICMP echo reply, id 32055, seq 0, length 40
```

 192.168.178.50 is my camera ip, 192.168.178.2 is my server ip.

here the log on neolink in the same timeframe:
```
[2026-07-25 16:09:53.981] [INF] front door: detection push (person+vehicle) NOT recorded — every label is unticked in this camera's event types
[2026-07-25 16:10:34.072] [INF] Retro (Main): brief fast-ping blip (1 sample(s)) ended before the 3-sample wake confirmation — not connecting (blip #2 this park; a real wake holds flat longer)
[2026-07-25 16:11:13.086] [INF] Retro (Main): brief fast-ping blip (1 sample(s)) ended before the 3-sample wake confirmation — not connecting (blip #3 this park; a real wake holds flat longer)
[2026-07-25 16:11:33.159] [INF] Retro (Main): brief fast-ping blip (1 sample(s)) ended before the 3-sample wake confirmation — not connecting (blip #4 this park; a real wake holds flat longer)
[2026-07-25 16:11:59.329] [INF] front door: detection push (motion) NOT recorded — every label is unticked in this camera's event types
```

Ah, some side effects of intercept the notification with neolink: I can no longer interact with my video intercom. Naturally, I stopped receiving notifications when someone rings the door, which previously allowed me to open the audio stream to respond. I know there isn't a solution for this, I just want to inform you.

**Comment by borexola** [comment]
Hi, I expect to see some wake hints in your logs. 
Looks like its falling back to the old icmp method to me.

e.g. 
`Wake hints: push decoy contacted by 10.1.0.40 (tcp/443) — the DNS override works`
Neolink only listens. If the camera doesnt send out a Notification, it wont know.

You config also has to be correct. For your scenario, try this:
```
"cameras": [
 {
      "password": "mypassword",
      "name": "TestCam",
      "address": "10.1.0.13",
      "username": "admin",
      "uid": "9527...",
      "always_on": false,
      "udp": true,
      "udp_probe": true,
      "wake_capture": true
    }
]

"wake_hints": {
    "syslog_port": 0,
    "push_ports": [
      443,
      53
    ]
  },
```
Also ensure ports 443,53 to your server are open.

Let me know.

**Comment by borexola** [comment]
For your notification issue,
You can try creating a Dashboard on HA with a camera card with mic (whichever one you prefer)
And create an HA notification that goes to your phone when `visitor = "On"` with a target to the dashboard.

Neolink supports 2-way rtsp stream. See [Feature Request](https://github.com/borexola/neolink.net/issues/38)
Let me know if you need any help setting this up

**Comment by Rihan9** [comment]
Currently testing why my camera decided to not send notification anymore. I fixed my config, it was wrong as you predicted. I'll probably go with the solution that you suggested for the door bell.

**Comment by borexola** [comment]
Be sure push notification is enabled for the cam in the reolink app before you switch dns to Neolink.net
If you have any issues, send me some logs.

**Comment by borexola** [comment]
Any luck?

**Comment by s256** [comment]
hey @borexola just came back from vacation. I'll give it a spin today. don't have pfsense or opnsense, but pi-hole.
But pihole is running on the same host as Neolink.Net, so this will collide with the integrated dns service. I also run traefik as reverse proxy on the same machine, which blocks 443. As I have a UDP Camera, I attached the container to the host network. Which in turn won't let me put traefik in front of it. (Traefik runs as container as well and uses the docker-labels for config). 

I will need to figure out the right config for the web service on 443. I assume any SSL Cert will do. 
Regarding DNS/53: what is your service doing? and is it a problem if I overwrite DNS on pihole and not use your DNS config?

I read https://github.com/borexola/neolink.net/blob/v0.9.7/CHANGELOG.md#097 but these questions are not addressed (happy to extend the readme myself, once I get it running).

**Comment by borexola** [comment]
Hey, welcome back.

So there's no need for a cert. The camera's connection attempt is the whole signal.
Neolink.NET never speaks TLS here, it accepts, notes the IP, and closes. Don't put it behind Traefik, it's not a web service.

Neolink.net has no DNS service. On pi-hole: add a Local DNS Record pointing `pushx.reolink.com ` at the Neolink.net host. The 53 in `push_ports `isn't DNS either, it's a second TCP listener for firmwares that push to port 53. Pi-hole already owns 53 on your host, so just use `"push_ports": [443].`


Traefik on 443 is your one real conflict. The cameras picks the port, so Neolink.NET needs 443 on the IP that `pushx.reolink.com` resolves to:

Can you try the following:

Add a second IP to the host (e.g. .44).
Pin Traefik's mapping to the first one: `"192.168.1.43:443:443"` (an unpinned 443:443 grabs every host address).
Neolink.NET: `"wake_hints": { "syslog_port": 0, "push_ports": [443], "bind": "192.168.1.44" }`
Pi-hole: `pushx.reolink.com -> 192.168.1.44`.
Enable push in the Reolink app first, then add the override, then power-cycle the camera.
The log will show` push decoy contacted by <camera-ip>` on the first PIR event.

Let me know if this works.

**Comment by s256** [comment]
Got it working with a `macvlan` interface

```
  networks:
    neolinklan:
      driver: macvlan
      driver_opts:
        parent: enp1s0
      ipam:
        config:
          - subnet: 192.168.0.0/24
            gateway: 192.168.0.1
            ip_range: 192.168.0.96/29  # small range reserved for containers
    traefik_proxy:
      external: true

  services:
    neolink:
      image: ghcr.io/borexola/neolink.net:latest
      container_name: neolink
      restart: unless-stopped
      environment:
        - TZ=Europe/Berlin
      networks:
        neolinklan:
          ipv4_address: 192.168.0.98
        traefik_proxy:
      volumes:
        - /opt/neolinkNet/data/config:/config
        - /opt/neolinkNet/data/recordings:/recordings
        - /opt/neolinkNet/data/clips:/clips
        - /opt/neolinkNet/data/archive:/archive
      labels:
        ##################################
        ## Traefik (new)
        ##################################
        traefik.enable: "true"

        # Router
        traefik.http.routers.neolink.rule: "Host(`neolink.local`)"
        traefik.http.routers.neolink.entrypoints: "websecure"
        traefik.http.routers.neolink.tls.certresolver: "http"
        traefik.http.services.neolink.loadbalancer.server.port: 8655
        traefik.docker.network: "traefik_proxy"

```

I see the events now. So, yes can confirm that it works. I'll now monitor the battery usage again. :)
